case_part1,case_part2
alibaba bonds dilemma location timing pricing emir hrnjic wrote case solely provide material class discussion authors intend illustrate either effective ineffective handling managerial situation authors may disguised certain names identifying information protect confidentiality publication may transmitted photocopied digitized otherwise reproduced form means without permission copyright holder reproduction material covered authorization reproduction rights organization order copies request permission reproduce materials contact ivey publishing ivey business school western university london ontario canada cases ivey ca www iveycases com copyright richard ivey school business foundation version november chief financial officer cfo alibaba group holding limited alibaba embarked series meetings potential investors gather information impending bond issue maggie wu scheduled lead alibaba team hong kong singapore london course three days alibaba listed new york stock exchange nyse overwhelming majority revenues originated china investors heard alibaba months prior initial public offering ipo september also high tech company alibaba subject potential large swings valuations typical industry making difficult price bond issue arduous task wu team lay ahead would investors subscribe bond issue would best location issuing alibaba bonds bonds issued importantly would bonds priced alibaba group ipo september alibaba became china largest commerce company alibaba online shopping website taobao com accounted roughly per cent china consumer consumer market online retail outlet tmall com captured per cent business consumer market share china global terms gross merchandise volume alibaba market places us billion exceeded major competitors see exhibits alibaba selected financial results ratios exhibit alibaba income statement exhibit components alibaba revenue exhibit alibaba balance sheet alibaba described mixture retailers like amazon ebay financial services like paypal search engine giant like google dominant company china commerce sector alibaba perfectly positioned benefit rise china middle class purchasing power alibaba recent fundraising alibaba actively raising funds growth overwhelming majority early stage financing came private equity investors typical start companies alibaba started using different forms financing instance alibaba raised billion syndicated loans take alibaba com private bringing back within alibaba group company used proceeds another syndicated loan buy back cost billion half stake yahoo alibaba finally alibaba went public nyse september financing rounds different challenges pricing syndicated loans march alibaba received billion syndicated loan five mandated lead arrangers book runners dual tranche loan consisted billion three year loan designated facility rate london interbank offered rate libor plus basis points bps billion one year loan designated facility rate libor plus bps facility loan interest rate increases sixth ninth months translating blended margin bps libor alibaba rated time issuance see exhibits spreads fees loan august alibaba signed new billion four year loan agreement eight banks rate libor plus bps alibaba billion loan launched syndication may nine underwriters new loan priced lower billion loan taken new loan comprised billion three year revolving loan yielding libor plus bps billion three year term loan facility also yielding libor plus bps billion five year term loan facility spread libor plus bps spreads would drop alibaba total leverage decreased see exhibit spreads fees loan initial public offering company continued fund raising may alibaba filed securities exchange commission sec go public alibaba underwriters estimated company fair value would reach per share september alibaba went public per share price rose first day trading first day return per cent market capitalization reached billion alibaba received billion claimed title largest ipo history nyse acquisition spree alibaba made numerous investments acquisitions among others company invested million intime retail group chain department grocery stores also acquired per cent stake chinavision chinese entertainment company approximately million notable investments included tango messaging app million lyft ride sharing app million youku tudou chinese online video provider billion china smart logistics network logistics platform commerce million singapore post million ucweb mobile browser search engine undisclosed amount autonavi holdings ltd chinese digital mapping navigation company million huayi brothers china largest private sector film company million seemed company spending substantial amounts cash investments intention slowing governance ownership structure alibaba senior management consisting partners right nominate majority candidates company board directors directors would approved shareholders alibaba vice chairman joseph tsai claimed structure allowed management focus long term interest company would therefore beneficial shareholders structure meant sustain company culture innovation internet companies also gone public similar structures included facebook google linkedin companies founders top executives exerted control superior voting shares tsai said alibaba web site also noticed many great companies quickly deteriorate founders leave vein number successful founders also made fatal mistakes final governance structure selected replace founders partners reason simple group partners cherish culture ideals likely carry forward principles make good decisions stakeholders long term view decade come partners guided principles grappling inevitable disruption competition believe partnership system right way build sustainable business partners peers without bureaucracy rigid hierarchy solve problems collaboration partners managers owners business keen sense responsibility partnership rejuvenated year admission new partners provides continuity longevity living body system believe sustain flame innovation constantly improve talent pool people run alibaba business variable interest entities vies chinese government restricted foreign direct ownership certain industries internet content providers icps order circumvent restrictions chinese companies designed variable interest entities vies allowed companies invite foreign investment staying within chinese law vies held licenses business china paid fees royalties offshore holding companies based contractual agreement two case alibaba licenses operate various websites china held vies majority owned per cent jack ma founder chairman alibaba minority owned simon xie alibaba co founder chinese government courts maintained neutral stand respect use vies signs chinese government considering new law would legitimize vie structure foreign listed chinese companies web services company baidu well hong kong listed companies internet service portal tencent used vie structure typically chinese companies listed uncertainty related vie structures ipo prospectus specifically alibaba stated following filing contractual arrangements give us effective control variable interest entities enable us obtain substantially economic benefits arising variable interest entities well consolidate financial results variable interest entities results operations although structure adopted consistent longstanding industry practice commonly adopted comparable companies china prc people republic china government may agree arrangements comply prc licensing registration regulatory requirements existing policies requirements policies may adopted future hese contractual arrangements may effective direct ownership providing alibaba control variable interest entities market conditions federal reserve interest rates economy slowed federal reserve fed encouraged banks make loans reducing interest rate banks borrow money overnight making cheaper banks lend global financial crisis fed reduced overnight interest rate almost zero low interest rate environment together quantitative easing measures taken fed kept economy going several years global financial crisis environment made favourable companies issue debt financial climate great corporations interested raising money fixed income instruments specifically trillion global corporate bonds issued united states year making record breaking year corporate bonds issues treasury yields dropped new lows yield year treasury fell per cent january per cent october see exhibits time low default rates encouraged investors contributed increased demand corporate bonds however international monetary fund imf warned half decade official borrowing costs close zero encouraged speculation rather hoped pick investment fact jose vinals imf financial counsellor said policymakers facing new global imbalance enough economic risk taking support growth increasing excesses financial risk taking posing stability challenges additionally senior fed officials james bullard charles plosser advocating higher interest rates concerns imf arguments fed officials tapering reducing quantitative easing started january caused market participants worry rates might start rising soon even though widely expected fed would eventually move low normal interest rates shift would probably gradual since sudden change would likely lead volatility financial markets agreement november federal reserve chair janet yellen said continue anticipate headwinds associated financial crisis wane employment economic activity inflation rates return normal monetary policy eventually need normalize although speed timing normalization likely differ across countries based differences pace recovery domestic conditions normalization could lead heightened financial volatility noted occasions part federal reserve strive clearly transparently communicate monetary policy strategy order minimize likelihood surprises could disrupt financial markets home around world importantly normalization monetary policy important sign economic conditions generally finally emerging shadow great recession china exchange rate policy china central bank people bank china pboc maintained policy fixing chinese yuan exchange rate dollar many analysts believed china exchange rate kept historically low relative yuan true value order keep china exports cheaper china economy relied exports bank policy fostered growth country reduced uncertainty however order achieve fixed exchange rate pboc needed assure markets would exchange yuan dollars fixed rate yuan indeed undervalued chinese exports would increase exporters would many dollars would need exchange yuan order avoid buying upward pressure yuan pboc accumulated reserve dollars treasuries yuan accelerated meant yuan circulating outside jurisdiction pboc analysts predicted point chinese yuan would share equal status dollar euro pound yen alibaba bond ratings announcing plans bond issue alibaba received first debt rating plus standard poor fitch ratings equivalent rating moody investor service ratings considered investment grade according standard poor website obligor bond issuer rating strong capacity meet financial commitments somewhat susceptible adverse effects changes circumstances economic conditions obligors higher rated categories aaa aa standard poor also added ratings aa ccc may modified addition plus minus sign show relative standing within major rating categories see exhibit exhibit shows financial characteristics exhibit shows recent bond issues similar companies epilogue analysts wondered investors would subscribe issue alibaba determine pricing additionally would best location alibaba bonds bonds issued would investors subscribe issue analysts also wondered investors would expect country risk premium given alibaba based china additionally certain governance issues specifically dual class ownership structures vies made investors uneasy long week lay ahead exhibit alibaba selected financial results ratios note currency millions except noted source bloomberg alibaba financial results ratios bloomberg database accessed december exhibit alibaba income statement exhibit continued source alibaba group holding limited form registration statement securities act edgar online may accessed may www sec gov archives edgar data df htm exhibit components alibaba revenue source alibaba group holding limited form registration statement securities act edgar online may accessed may www sec gov archives edgar data df htm exhibit alibaba balance sheet source alibaba group holding limited form registration statement securities act edgar online may accessed may www sec gov archives edgar data df htm exhibit spreads fees alibaba loan note mlab mandated lead arrangers book runners mla mandated lead arrangers source prakash chakravarti alibaba woos lenders juicy returns us bn loan ifr international financing review march accessed may www ifre com alibaba woos lenders juicy returns us bn loan article exhibit fees alibaba loan note mlab mandated lead arrangers book runners mla mandated lead arrangers blended fees average fees across two facilities blended ins interest margin plus annual fee annual fee upfront fee divided average life loan source prakash chakravarti alibaba woos lenders juicy returns us bn loan ifr international financing review march accessed may www ifre com alibaba woos lenders juicy returns us bn loan article exhibit spreads fees alibaba loan offshore groups leverage drops offshore groups leverage drops source alibaba usd billion loan allocated among banks signing shortly debtwire july exhibit recent yields spreads source selected interest rates daily historical data board governors federal reserve system accessed december https www federalreserve gov datadownload choose aspx rel exhibit government bond yield curve source created author based bloomberg bond yields bloomberg database accessed december exhibit ratings rating agency note ratings aa ccc may modified addition plus minus sign show relative standing within major rating categories source ratingsdirect standard poor ratings definitions standard poor ratings services mcgraw hill financial november accessed october www spratings com documents standard poor ratings definitions fd ad exhibit comparables source created author based bloomberg bloomberg database accessed december exhibit recent bond issues source created author based bloomberg bloomberg database accessed december endnotes,
emir hrnjic wrote case solely provide material class discussion authors intend illustrate either effective ineffective handling managerial situation authors may disguised certain names identifying information protect confidentiality,
publication may transmitted photocopied digitized otherwise reproduced form means without permission copyright holder reproduction material covered authorization reproduction rights organization order copies request permission reproduce materials contact ivey publishing ivey business school western university london ontario canada cases ivey ca www iveycases com,
